{
  "version": "1.0",
  "meta": {
    "generated_at": "2026-02-14T15:01:07.600Z",
    "source_hash": "blog-schema-v1"
  },
  "extensions": [
    {
      "uri": "https://kernel.astrale.ai/v1",
      "imported_types": [
        "Identity"
      ]
    }
  ],
  "builtin_scalars": [
    "String",
    "Int",
    "Float",
    "Boolean",
    "Timestamp"
  ],
  "type_aliases": [
    {
      "name": "Email",
      "underlying_type": "String",
      "constraints": {
        "format": "email"
      }
    },
    {
      "name": "Slug",
      "underlying_type": "String",
      "constraints": {
        "format": "slug"
      }
    },
    {
      "name": "Plan",
      "underlying_type": "String",
      "constraints": {
        "enum_values": [
          "free",
          "pro",
          "enterprise"
        ]
      }
    },
    {
      "name": "OrgRole",
      "underlying_type": "String",
      "constraints": {
        "enum_values": [
          "member",
          "admin",
          "owner"
        ]
      }
    },
    {
      "name": "PostStatus",
      "underlying_type": "String",
      "constraints": {
        "enum_values": [
          "draft",
          "published",
          "archived"
        ]
      }
    }
  ],
  "classes": [
    {
      "type": "node",
      "name": "Timestamped",
      "abstract": true,
      "implements": [],
      "attributes": [
        {
          "name": "created_at",
          "type": {
            "kind": "Scalar",
            "name": "Timestamp"
          },
          "nullable": false,
          "default": {
            "kind": "Call",
            "fn": "now",
            "args": []
          },
          "modifiers": {
            "readonly": true,
            "indexed": "desc"
          }
        },
        {
          "name": "updated_at",
          "type": {
            "kind": "Scalar",
            "name": "Timestamp"
          },
          "nullable": true,
          "default": null,
          "modifiers": {}
        }
      ]
    },
    {
      "type": "node",
      "name": "Publishable",
      "abstract": true,
      "implements": [
        "Timestamped"
      ],
      "attributes": [
        {
          "name": "published_at",
          "type": {
            "kind": "Scalar",
            "name": "Timestamp"
          },
          "nullable": true,
          "default": null,
          "modifiers": {}
        },
        {
          "name": "status",
          "type": {
            "kind": "Alias",
            "name": "PostStatus"
          },
          "nullable": false,
          "default": {
            "kind": "StringLiteral",
            "value": "draft"
          },
          "modifiers": {}
        }
      ]
    },
    {
      "type": "node",
      "name": "Reactable",
      "abstract": true,
      "implements": [],
      "attributes": [
        {
          "name": "reaction_count",
          "type": {
            "kind": "Scalar",
            "name": "Int"
          },
          "nullable": false,
          "default": {
            "kind": "NumberLiteral",
            "value": 0
          },
          "modifiers": {}
        }
      ]
    },
    {
      "type": "node",
      "name": "User",
      "abstract": false,
      "implements": [
        "Identity",
        "Timestamped"
      ],
      "attributes": [
        {
          "name": "username",
          "type": {
            "kind": "Scalar",
            "name": "String"
          },
          "nullable": false,
          "default": null,
          "modifiers": {
            "unique": true
          }
        },
        {
          "name": "email",
          "type": {
            "kind": "Alias",
            "name": "Email"
          },
          "nullable": false,
          "default": null,
          "modifiers": {
            "unique": true
          }
        },
        {
          "name": "display_name",
          "type": {
            "kind": "Scalar",
            "name": "String"
          },
          "nullable": true,
          "default": null,
          "modifiers": {}
        },
        {
          "name": "bio",
          "type": {
            "kind": "Scalar",
            "name": "String"
          },
          "nullable": true,
          "default": null,
          "modifiers": {}
        }
      ]
    },
    {
      "type": "node",
      "name": "Organization",
      "abstract": false,
      "implements": [
        "Identity",
        "Timestamped"
      ],
      "attributes": [
        {
          "name": "name",
          "type": {
            "kind": "Scalar",
            "name": "String"
          },
          "nullable": false,
          "default": null,
          "modifiers": {}
        },
        {
          "name": "slug",
          "type": {
            "kind": "Alias",
            "name": "Slug"
          },
          "nullable": false,
          "default": null,
          "modifiers": {
            "unique": true
          }
        },
        {
          "name": "plan",
          "type": {
            "kind": "Alias",
            "name": "Plan"
          },
          "nullable": false,
          "default": {
            "kind": "StringLiteral",
            "value": "free"
          },
          "modifiers": {}
        }
      ]
    },
    {
      "type": "node",
      "name": "Post",
      "abstract": false,
      "implements": [
        "Publishable",
        "Reactable"
      ],
      "attributes": [
        {
          "name": "title",
          "type": {
            "kind": "Scalar",
            "name": "String"
          },
          "nullable": false,
          "default": null,
          "modifiers": {}
        },
        {
          "name": "body",
          "type": {
            "kind": "Scalar",
            "name": "String"
          },
          "nullable": false,
          "default": null,
          "modifiers": {}
        },
        {
          "name": "slug",
          "type": {
            "kind": "Alias",
            "name": "Slug"
          },
          "nullable": false,
          "default": null,
          "modifiers": {
            "unique": true
          }
        }
      ]
    },
    {
      "type": "node",
      "name": "Comment",
      "abstract": false,
      "implements": [
        "Reactable",
        "Timestamped"
      ],
      "attributes": [
        {
          "name": "body",
          "type": {
            "kind": "Scalar",
            "name": "String"
          },
          "nullable": false,
          "default": null,
          "modifiers": {}
        }
      ]
    },
    {
      "type": "node",
      "name": "Tag",
      "abstract": false,
      "implements": [],
      "attributes": [
        {
          "name": "name",
          "type": {
            "kind": "Scalar",
            "name": "String"
          },
          "nullable": false,
          "default": null,
          "modifiers": {
            "unique": true
          }
        },
        {
          "name": "slug",
          "type": {
            "kind": "Alias",
            "name": "Slug"
          },
          "nullable": false,
          "default": null,
          "modifiers": {
            "unique": true
          }
        }
      ]
    },
    {
      "type": "edge",
      "name": "follows",
      "endpoints": [
        {
          "param_name": "follower",
          "allowed_types": [
            {
              "kind": "Node",
              "name": "User"
            }
          ],
          "cardinality": {
            "min": 0,
            "max": 5000
          }
        },
        {
          "param_name": "followee",
          "allowed_types": [
            {
              "kind": "Node",
              "name": "User"
            }
          ],
          "cardinality": null
        }
      ],
      "attributes": [],
      "constraints": {
        "no_self": true,
        "acyclic": false,
        "unique": true,
        "symmetric": false
      }
    },
    {
      "type": "edge",
      "name": "authored",
      "endpoints": [
        {
          "param_name": "author",
          "allowed_types": [
            {
              "kind": "Node",
              "name": "User"
            }
          ],
          "cardinality": null
        },
        {
          "param_name": "content",
          "allowed_types": [
            {
              "kind": "Node",
              "name": "Post"
            },
            {
              "kind": "Node",
              "name": "Comment"
            }
          ],
          "cardinality": {
            "min": 1,
            "max": 1
          }
        }
      ],
      "attributes": [],
      "constraints": {
        "no_self": false,
        "acyclic": false,
        "unique": false,
        "symmetric": false
      }
    },
    {
      "type": "edge",
      "name": "comment_on",
      "endpoints": [
        {
          "param_name": "comment",
          "allowed_types": [
            {
              "kind": "Node",
              "name": "Comment"
            }
          ],
          "cardinality": {
            "min": 1,
            "max": 1
          }
        },
        {
          "param_name": "target",
          "allowed_types": [
            {
              "kind": "Node",
              "name": "Post"
            },
            {
              "kind": "Node",
              "name": "Comment"
            }
          ],
          "cardinality": null
        }
      ],
      "attributes": [],
      "constraints": {
        "no_self": false,
        "acyclic": true,
        "unique": false,
        "symmetric": false,
        "on_kill_target": "cascade"
      }
    },
    {
      "type": "edge",
      "name": "tagged_with",
      "endpoints": [
        {
          "param_name": "post",
          "allowed_types": [
            {
              "kind": "Node",
              "name": "Post"
            }
          ],
          "cardinality": null
        },
        {
          "param_name": "tag",
          "allowed_types": [
            {